{
  "version": "1.0",
  "source": {
    "path": "synthetic-cuts.mp4",
    "duration": 3.0,
    "fps": 30.0,
    "width": 160,
    "height": 90,
    "codec": "h264"
  },
  "detection": {
    "method": "ContentDetector",
    "threshold": 27.0,
    "min_scene_len_frames": 1,
    "pyscenedetect_version": "0.7.1"
  },
  "scenes": [
    {"index": 1, "start": 0.0, "end": 1.0, "duration": 1.0},
    {"index": 2, "start": 1.0, "end": 2.0, "duration": 1.0},
    {"index": 3, "start": 2.0, "end": 3.0, "duration": 1.0}
  ]
}
